<?xml version="1.0" encoding="UTF-8"?>
<reservas xmlns:xsi="http://www.w3.org/2001/XMLSchema-instance"
xsi:noNamespaceSchemaLocation="reservas_vuelos.xsd">
    <reserva id="R001">
        <cliente>
            <nombre>María López</nombre>
            <email>maria@example.com</email>
            <telefono>987654321</telefono>
        </cliente>
        <vuelo>
            <origen>Madrid</origen>
            <destino>Barcelona</destino>
            <fecha>2025-06-15</fecha>
            <hora_salida>10:00</hora_salida>
            <hora_llegada>12:00</hora_llegada>
            <precio>120.00</precio>
        </vuelo>
    </reserva>
    <reserva id="R002">
        <cliente>
            <nombre>Carlos García</nombre>
            <email>carlos@example.com</email>
            <telefono>123987654</telefono>
        </cliente>
        <vuelo>
            <origen>Valencia</origen>
            <destino>Madrid</destino>
            <fecha>2025-06-20</fecha>
            <hora_salida>16:00</hora_salida>
            <hora_llegada>18:00</hora_llegada>
            <precio>150.00</precio>
        </vuelo>
    </reserva>
</reservas>